,tipo_obra,escala,escala_tramos,usos,im_sociedad,im_econom,im_ma,im_trans,titulo_Obra,acr,año,pais,ambito,presupuesto,moneda,autores,img_url,web_url,categoria,city,lat,lon
0,Obra nueva,220.0,s,Residencial,Equidad espacial,Accesibilidad a la vivienda,"Eficiencia energética, Espacios saludables",Ciencias de ciudad,VU4B,TDA454,2020,Paraguay,Sur,80000,$,TDA®,http://www.bienalesdearquitectura.es/images/XII_BIAU/Panorama_obras/20220223124656_01-dji-0106.jpg,http://www.bienalesdearquitectura.es/index.php/es/?option=com_content&view=article&id=10474,obras,caracas,10.500000,-66.916664
1,"Ampliación, reforma o rehabilitación",200.0,s,"Residencial, Servicios",Usos mixtos,"Tenencias alternativas, Accesibilidad a la vivienda, Regeneración urbana",Rehabilitación,,Habitando una galería de arte,XYZ097,2021,Portugal,Península Ibérica,145000,€,"Filipe Magalhães, Ana Luisa Soares, Ahmed Belkhodja, Lera Samovich",http://www.bienalesdearquitectura.es/images/XII_BIAU/Panorama_obras/20220223170204_fala-097-web-013.jpg,http://www.bienalesdearquitectura.es/index.php/es/?option=com_content&view=article&id=10475,obras,medellin,6.230833,-75.590553
2,"Ampliación, reforma o rehabilitación",226.16,s,Residencial,Usos mixtos,Regeneración urbana,Rehabilitación,Proyectos urbanos integrales,Loft A. Transformación de taller en vivienda en el barrio de la Milagrosa de Pamplona,LAP010,Sin datos,Espana,Península Ibérica,184768,€,arrova | atelier rojo-vergara (arquitectos Enrique Rojo Asín y Cristina Vergara Lacuey),http://www.bienalesdearquitectura.es/images/XII_BIAU/Panorama_obras/20220301163212_05-loft-a-bergeraphoto.jpg,http://www.bienalesdearquitectura.es/index.php/es/?option=com_content&view=article&id=10492,trayectoria,antioquia,7.883609,-76.632111
3,Obra nueva,381.0,m,Residencial,,Regeneración urbana,"Reducción emisiones C02, Eficiencia energética, Espacios saludables",Proyectos urbanos integrales,CASA CON ARBOL,CAM022,Sin datos,Espana,Península Ibérica,320486,€,CRISTINA GARCIA BAEZA / IÑAKI PÉREZ DE LA FUENTE,http://www.bienalesdearquitectura.es/images/XII_BIAU/Panorama_obras/20220302105146_1-entrada.jpg,http://www.bienalesdearquitectura.es/index.php/es/?option=com_content&view=article&id=10494,publicacion,santiago de chile,-34.672501,-58.449722
4,"Ampliación, reforma o rehabilitación",35408.0,xl,Residencial,Protección patrimonial,,"Rehabilitación, Reutilización y reciclaje, Espacios saludables",Autosuficiencias domésticas,CASA Z. Rehabilitación de vivienda en el Valle de Jerte,CAZ079,Sin datos,Espana,Península Ibérica,19229452,€,Arq. Joaquín Mosquera Casares y Arq. Syra Abella Bule,http://www.bienalesdearquitectura.es/images/XII_BIAU/Panorama_obras/20220303125420_imagen-principal-baja-calidad.jpg,http://www.bienalesdearquitectura.es/index.php/es/?option=com_content&view=article&id=10497,prog_doc,iquique,-20.216700,-70.142220
5,Proyecto efímero,65.0,s,Espacios libres,"Procesos participativos, Equidad espacial",Cooperación publico-privada,Reutilización y reciclaje,Autosuficiencias comunitarias,Aula Caracola,CAR019,2019,Mexico,,250,€,Conjuntos Empáticos (Sálvora Feliz + Marta Benito + Tomás Pineda),http://www.bienalesdearquitectura.es/images/XII_BIAU/Panorama_obras/20220303193859_fel0041-foto00.jpg,http://www.bienalesdearquitectura.es/index.php/es/?option=com_content&view=article&id=10499,acc,la paz,-16.489689,-68.119293
